{
  "$schema": "https://raw.githubusercontent.com/virajp/ai-plugins/main/schemas/statusline.schema.json",
  "projectName": "Project-Name",
  "defaultFg": "white",
  "gauge": {
    "empty": "в–±",
    "filled": "в–°",
    "width": 10
  },
  "lines": [
    [
      "model",
      "context",
      "rl5h",
      "rl7d",
      "cost"
    ],
    [
      "project",
      "worktree",
      "branch"
    ]
  ],
  "palette": {
    "aqua": [
      104,
      157,
      106
    ],
    "bg3": [
      102,
      92,
      84
    ],
    "blue": [
      69,
      133,
      136
    ],
    "green": [
      152,
      151,
      26
    ],
    "grey": [
      60,
      56,
      54
    ],
    "orange": [
      214,
      93,
      14
    ],
    "purple": [
      177,
      98,
      134
    ],
    "red": [
      204,
      36,
      29
    ],
    "white": [
      251,
      241,
      199
    ],
    "yellow": [
      215,
      153,
      33
    ]
  },
  "powerline": {
    "cap": "о‚¶",
    "sep": "о‚°",
    "sepThin": "о‚±",
    "thinFg": "grey"
  },
  "segments": {
    "branch": {
      "bg": "aqua"
    },
    "context": {
      "bg": "aqua"
    },
    "cost": {
      "bg": "green",
      "bold": true,
      "fg": "white"
    },
    "duration": {
      "bg": "aqua"
    },
    "model": {
      "bg": "blue",
      "bold": true,
      "fg": "white"
    },
    "project": {
      "bg": "green",
      "bold": true,
      "fg": "white"
    },
    "rl5h": {
      "bg": "blue"
    },
    "rl7d": {
      "bg": "purple"
    },
    "session": {
      "bg": "orange"
    },
    "worktree": {
      "bg": "yellow",
      "fg": "grey"
    }
  },
  "subagent": {
    "descBudgetFraction": 0.45,
    "segments": {
      "desc": {
        "bg": "bg3"
      },
      "duration": {
        "bg": "purple"
      },
      "head": {
        "bold": true
      },
      "model": {
        "bg": "blue"
      },
      "tokens": {
        "bg": "aqua"
      }
    },
    "statuses": {
      "done": {
        "bg": "green",
        "match": "done|complete|success|finish|ok",
        "symbol": "пЂЊ"
      },
      "error": {
        "bg": "red",
        "match": "error|fail|cancel|abort",
        "symbol": "пЂЌ"
      },
      "pending": {
        "bg": "bg3",
        "match": "",
        "symbol": "пЂ—"
      },
      "running": {
        "bg": "blue",
        "match": "run|active|progress|working|busy",
        "symbol": "пЃ‹"
      }
    }
  },
  "symbols": {
    "agent": "пЂ‡",
    "branch": "о‚ ",
    "context": "п‡Ђ",
    "cost": "п…•",
    "dirtyAdd": "+",
    "dirtyDel": "-",
    "dirtyMix": "В±",
    "duration": "пЂ—",
    "folder": "пЃ»",
    "model": "вљЎ",
    "repo": "пђЃ",
    "reset": "в†»",
    "session": "пЂ«",
    "tokens": "п”ћ",
    "win5h": "п‰’",
    "win7d": "пЃі",
    "worktree": "рџЊІ"
  },
  "typeSymbols": {
    "_default": "п•„",
    "background": "пЂ“",
    "cloud_agent": "пѓ‚",
    "local_agent": "п„‰",
    "mcp": "п‡¦",
    "remote_agent": "пѓ‚",
    "review": "пЃ®",
    "task": "п‚®",
    "test": "пѓѓ"
  },
  "worktreePattern": "worktree"
}
